{
  "schemaVersion": "1.0.0",
  "sourceCommit": "75d3f9a0ed92ccde4bcbc32b890b54af654c272c",
  "sourceBinding": "Implementation and evidence-generation source at this commit. Individual corpus/performance/gate records bind their actual invocation commit. Later evidence-only commits may change HEAD; no historical release artifact is rewritten.",
  "version": "0.6.0-alpha.12",
  "baselineCommit": "4e13b96cc3539e1b623a4c5a12f10a0954776253",
  "baselineTagObject": "e692f1e23d58157a209f511adb6180d3f489a80c",
  "tests": {
    "total": 455,
    "passed": 455,
    "failed": 0,
    "skipped": 0,
    "sandboxPassed": 13,
    "sandboxSkipped": 0,
    "evidence": "validation/alpha12/local-verification.json"
  },
  "corpus": {
    "groundTruth": "INCOMPLETE",
    "recall": null,
    "accuracy": null,
    "identities": [
      {
        "repository": "OWASP/NodeGoat",
        "commit": "c5cb68a7084e4ae7dcc60e6a98768720a81841e8",
        "scansCompleted": 2,
        "determinism": "PASSED",
        "evidence": "validation/alpha12/corpus/nodegoat.json"
      },
      {
        "repository": "appsecco/dvna",
        "commit": "9ba473add536f66ac9007966acb2a775dd31277a",
        "scansCompleted": 2,
        "determinism": "PASSED",
        "evidence": "validation/alpha12/corpus/dvna.json"
      },
      {
        "repository": "expressjs/express",
        "commit": "53d4a0d606c0388f764f192b306ce0e90200e7e8",
        "scansCompleted": 2,
        "determinism": "PASSED",
        "evidence": "validation/alpha12/corpus/express.json"
      },
      {
        "repository": "fastify/fastify",
        "commit": "d266f833f2bff34c6115c026e461b682e94d0b9c",
        "scansCompleted": 2,
        "determinism": "PASSED",
        "evidence": "validation/alpha12/corpus/fastify.json"
      },
      {
        "repository": "Vikas2171/vulnerable-website",
        "commit": "1258fa3efac1547da5bb3c7e6ab8279f00e47206",
        "scansCompleted": 2,
        "determinism": "PASSED",
        "evidence": "validation/alpha12/corpus/vikas-vulnerable-website.json"
      },
      {
        "repository": "juice-shop/juice-shop",
        "commit": "1618a611b173b4bf114028e6e02549950606e29d",
        "scansCompleted": 2,
        "determinism": "PASSED",
        "evidence": "validation/alpha12/corpus/juice-shop.json"
      },
      {
        "repository": "we45/Vulnerable-Flask-App",
        "commit": "b6a4f97afd466e83e1f60781494252dec1c37039",
        "scansCompleted": 2,
        "determinism": "PASSED",
        "evidence": "validation/alpha12/corpus/vulnerable-flask-app.json"
      },
      {
        "repository": "stephenbradshaw/breakableflask",
        "commit": "553e8b2f51c14f259f565d5df478339c366a9172",
        "scansCompleted": 2,
        "determinism": "PASSED",
        "evidence": "validation/alpha12/corpus/breakableflask.json"
      },
      {
        "repository": "pallets/flask",
        "commit": "d73fa1cdcbd8b1465c151db8924ba58b1dd14e35",
        "scansCompleted": 2,
        "determinism": "PASSED",
        "evidence": "validation/alpha12/corpus/flask.json"
      },
      {
        "repository": "LevaAverGit/appsec-review-lab-v2",
        "commit": "372ed54ad40059f4228f9e08dc375c51fe60b625",
        "scansCompleted": 2,
        "determinism": "PASSED",
        "evidence": "validation/alpha12/corpus/fastapi-appsec-lab.json"
      },
      {
        "repository": "vercel/nextjs-postgres-auth-starter",
        "commit": "fde8ecf1da9337223081f70cf88b420060039d6e",
        "scansCompleted": 2,
        "determinism": "PASSED",
        "evidence": "validation/alpha12/corpus/nextjs-auth.json"
      },
      {
        "repository": "AntonyNRM/vulnerable-flask-app",
        "commit": "7a12a015d0fc0d028be5cf492db822bce9af45ba",
        "scansCompleted": 2,
        "determinism": "PASSED",
        "evidence": "validation/alpha12/corpus/antony-vulnerable-flask.json"
      },
      {
        "repository": "axios/axios",
        "commit": "18e7dfedf30c96e58652887f930642ae82e0130c",
        "scansCompleted": 2,
        "determinism": "PASSED",
        "evidence": "validation/alpha12/corpus/axios.json"
      },
      {
        "repository": "django/django",
        "commit": "2b30f6255b5ef84afbd827993643d52ef2c0963a",
        "scansCompleted": 2,
        "determinism": "PASSED",
        "evidence": "validation/alpha12/corpus/django.json"
      },
      {
        "repository": "fastapi/fastapi",
        "commit": "50113da16fec53b66b80d75e80a89296de4fa5a5",
        "scansCompleted": 2,
        "determinism": "PASSED",
        "evidence": "validation/alpha12/corpus/fastapi.json"
      },
      {
        "repository": "guilatrova/flask-sqlinjection-vulnerable",
        "commit": "708246139f2f216c55c683c7aec2297bc91b7346",
        "scansCompleted": 2,
        "determinism": "PASSED",
        "evidence": "validation/alpha12/corpus/flask-sqlinjection.json"
      },
      {
        "repository": "payatu/vuln-nodejs-app",
        "commit": "bc3c90920ba4e1c668d954e5027d9ca814d2d5c6",
        "scansCompleted": 2,
        "determinism": "PASSED",
        "evidence": "validation/alpha12/corpus/payatu-vuln-node.json"
      },
      {
        "repository": "vulnerable-apps/simple-ssrf",
        "commit": "9fe0f47ca9bc69faf8454e96e0dcdf1400ce8a5a",
        "scansCompleted": 2,
        "determinism": "PASSED",
        "evidence": "validation/alpha12/corpus/simple-ssrf.json"
      },
      {
        "repository": "SirAppSec/vuln-node.js-express.js-app",
        "commit": "b977c7407f328da929577745ad509639e26c428a",
        "scansCompleted": 2,
        "determinism": "PASSED",
        "evidence": "validation/alpha12/corpus/sirappsec-vuln-node.json"
      },
      {
        "repository": "ryanmcmorrowsnyk/vulnerable-typescript-app",
        "commit": "7f8b240a2f02beba099da3632d1ba679ff8bc32f",
        "scansCompleted": 2,
        "determinism": "PASSED",
        "evidence": "validation/alpha12/corpus/vulnerable-typescript.json"
      },
      {
        "repository": "miguelgrinberg/microblog",
        "commit": "a975ef64864354867c88e0ed3a17ba7d17dca752",
        "scansCompleted": 2,
        "determinism": "PASSED",
        "evidence": "validation/alpha12/corpus/microblog.json"
      },
      {
        "repository": "pallets-eco/flask-security",
        "commit": "5d47d697d6f0806d0fe58559fe61cd6fd8ae16ef",
        "scansCompleted": 2,
        "determinism": "PASSED",
        "evidence": "validation/alpha12/corpus/flask-security.json"
      },
      {
        "repository": "encode/starlette",
        "commit": "03f12b7fcf0a3e21a8da648ca0900c79472e9efe",
        "scansCompleted": 2,
        "determinism": "PASSED",
        "evidence": "validation/alpha12/corpus/starlette.json"
      },
      {
        "repository": "fastapi/full-stack-fastapi-template",
        "commit": "cb740b656d7a0a6c5e12c7bf8e50343ec94ee9c7",
        "scansCompleted": 2,
        "determinism": "PASSED",
        "evidence": "validation/alpha12/corpus/full-stack-fastapi.json"
      },
      {
        "repository": "hagopj13/node-express-boilerplate",
        "commit": "179ae84efec61b14206d0305d941daed6c6d07f9",
        "scansCompleted": 2,
        "determinism": "PASSED",
        "evidence": "validation/alpha12/corpus/node-express-boilerplate.json"
      },
      {
        "repository": "sahat/hackathon-starter",
        "commit": "636440342a5b7b640d127dcde0c405c711c0ddaa",
        "scansCompleted": 2,
        "determinism": "PASSED",
        "evidence": "validation/alpha12/corpus/hackathon-starter.json"
      },
      {
        "repository": "gothinkster/node-express-realworld-example-app",
        "commit": "30b68e1e881462b2f4164ea09ab4c4f5699c7b0b",
        "scansCompleted": 2,
        "determinism": "PASSED",
        "evidence": "validation/alpha12/corpus/realworld-express.json"
      },
      {
        "repository": "expressjs/session",
        "commit": "96ebea4b6cd805584fba04523773b1b918a836d7",
        "scansCompleted": 2,
        "determinism": "PASSED",
        "evidence": "validation/alpha12/corpus/express-session.json"
      },
      {
        "repository": "fastify/fastify-secure-session",
        "commit": "06f4afb58d2a91e6350b71a6e491d4604333e6d4",
        "scansCompleted": 2,
        "determinism": "PASSED",
        "evidence": "validation/alpha12/corpus/fastify-secure-session.json"
      },
      {
        "repository": "strapi/strapi",
        "commit": "34fdea8fb4e11afc475a0ffdc14311cce09ddded",
        "scansCompleted": 2,
        "determinism": "PASSED",
        "evidence": "validation/alpha12/corpus/strapi.json"
      }
    ],
    "confirmedFP": 1,
    "supportedPatternFN": 0,
    "adjudicationScope": "No supported-pattern FN was discovered in the explicitly reviewed local flow cases and selective source reviews listed here. Ground truth is incomplete; this is not a claim of zero corpus-wide false negatives, complete recall, or accuracy. Unsupported constructs, resource-bound omissions, missing password-purpose semantics and fixture-only observations are accounted separately.",
    "unadjudicatedFindings": 0,
    "fpEvidence": [
      "validation/alpha12/baseline-evidence.json: three confirmed prior false insecure conclusions, retained as UNKNOWN in current corpus evidence",
      "validation/alpha12/closure/independent-corpus-review.json: one confirmed narrative-string lexical false-positive observation remains UNKNOWN; no current false-insecure proof established. confirmedFP includes this observation noise."
    ],
    "fnEvidence": [
      "validation/alpha12/corpus-adjudication.json: explicit review scope and unsupported-case separation"
    ],
    "unknown": {
      "applicationDataflow": 220,
      "authorization": 0,
      "authentication": 1,
      "findingProof": 13,
      "majorCauses": [
        "202: A state-changing Express route has an unresolved handler, so authentication and browser reachability are UNKNOWN.",